{
  "repository": {
    "root": "C:/Users/you/Documents/GitHub/your-repo"
  },
  "command_authorization": {
    "state": "granted",
    "authorization_ref": "user-invoked /repository-improvement-assessment",
    "inherited_from": null,
    "commands": [
      "node --test"
    ]
  },
  "sei_compatibility_binding": {
    "engine_version": "1.3.0",
    "effective_configuration": {},
    "config_hash": "b79606fb3afea5bd1609ed40b622142f1c98125abcfe89a76a661b0e8e343910",
    "execution_contract_hash": "a402c4336ebfd78227dea06341f394c60ab50d13d841cedf38df329afe4a304e",
    "history_window": {
      "kind": "full"
    },
    "history_window_hash": "259aa8ef98a8b91de574cd904138ef643240c23080cf24da4793a6f10a43fa9d",
    "assessment_schema_version": "sei.engineering-assessment@3",
    "analyzer_capabilities": {},
    "analyzer_capability_hash": "38a5be91af79d7e5ba9809bf383c699b6864ee50446239fe56a45e32b84638fe"
  },
  "lifecycle": "run",
  "depth": "standard",
  "scope": "head",
  "verification_contract": {
    "commands": [
      "node --test",
      {
        "command": "./scripts/smoke.sh",
        "kind": "test"
      }
    ]
  },
  "reuse_controls": {
    "SEI": "auto",
    "verification": "auto",
    "Health": "auto",
    "Integrity": "auto",
    "Architecture": "auto"
  },
  "presentation_policy": "generate",
  "allow_degraded": false
}
